{
  "operation_uuid": "00000000-0000-4000-8000-0000000003e9",
  "rule_uuid": "00000000-0000-4000-8000-0000000003e8",
  "organization_uuid": "00000000-0000-4000-8000-000000000002",
  "generation": 1,
  "target": "active",
  "definition": {
    "schema_version": "geofence-rule.v1",
    "uuid": "00000000-0000-4000-8000-0000000003e8",
    "version_uuid": "00000000-0000-4000-8000-0000000003e9",
    "evaluator_version": "geofence.v1",
    "pipeline": [
      "location.source.v1",
      "geofence.membership.v1",
      "condition.sustained.v1",
      "alert.condition.v1"
    ],
    "binding": {
      "schema_version": "location-binding.v1",
      "uuid": "00000000-0000-4000-8000-000000000001",
      "revision": 1,
      "organization_uuid": "00000000-0000-4000-8000-000000000002",
      "device_uuid": "00000000-0000-4000-8000-000000000003",
      "configuration_uuid": "00000000-0000-4000-8000-000000000004",
      "generation": 1,
      "latitude_parameter_uuid": "00000000-0000-4000-8000-000000000005",
      "longitude_parameter_uuid": "00000000-0000-4000-8000-000000000006",
      "accuracy_parameter_uuid": "00000000-0000-4000-8000-000000000007",
      "pairing": "same_event",
      "max_age_seconds": 90,
      "max_future_skew_seconds": 5,
      "allow_unknown_accuracy": true
    },
    "geometry": {
      "type": "Polygon",
      "coordinates": [
        [
          [
            -114.01,
            50.99
          ],
          [
            -113.99,
            50.99
          ],
          [
            -113.99,
            51.01
          ],
          [
            -114.01,
            51.01
          ],
          [
            -114.01,
            50.99
          ]
        ]
      ]
    },
    "policy": {
      "outside_for_seconds": 60,
      "max_gap_seconds": 45,
      "minimum_samples": 2,
      "uncertainty_metres": 2
    }
  }
}
